{
  "openship": "1.0",
  "capability": "sources",
  "digest": "sha256:1d322539e651a3c2d7c51eb8b33160627395b9601bff909e599771b806d9e565",
  "files": {
    "app/page.js": { "encoding": "utf-8", "content": "export default function Page() {}\n" },
    "package.json": { "encoding": "utf-8", "content": "{\"name\":\"example\"}\n" }
  }
}

